ID,Target,Question,Correct Answer,Distractor 1,Distractor 2,Distractor 3,D1,D2,D3,notes
172,objection,"The lawyer raised an <blank> to the evidence presented in court, arguing that it was not relevant to the case.",objection,agreement,approval,suggestion,0,0,1,a/an issue
173,obliged,"In some cultures, people feel <blank> to help their neighbors in times of need.",obliged,relaxed,unwilling,indifferent,0,1,0,more than one answer
174,obscure,The meaning of the old text was difficult to understand because the handwriting was so <blank>.,obscure,clear,bright,famous,0,0,0,
175,offend,"He didn’t mean to <blank> anyone with his comments, but some people found them inappropriate.",offend,praise,entertain,confuse,0,0,1,more than one answer
176,offensive,"Some people found his comments during the meeting to be quite <blank>, as they were rude and disrespectful.",offensive,polite,helpful,neutral,0,0,0,
177,omit,Please make sure not to <blank> any important details when filling out the form.,omit,include,repeat,highlight,0,0,0,
178,opponent,"During the chess match, he carefully studied his <blank> to predict their next move.",opponent,teammate,spectator,referee,0,0,0,
179,outward,"The train was heading <blank> from the city, taking passengers to the countryside.",outward,inward,upward,backward,0,0,0,
180,overflow,"After the heavy rain, the river began to <blank> and flood the nearby fields.",overflow,collapse,freeze,shrink,0,0,0,
181,overlook,"From the balcony, you can <blank> the beautiful valley and the river flowing through it.",overlook,ignore,block,miss,0,0,0,
182,overtake,The red car was going so fast that it managed to <blank> all the other vehicles on the highway.,overtake,follow,approach,avoid,0,0,0,
183,overthrow,The rebels planned to <blank> the government and take control of the country.,overthrow,support,protect,negotiate,0,0,0,
184,page,Please turn to the next <blank> in your book to continue reading the story.,page,chapter,cover,paragraph,1,0,0,more than one answer
185,pant,"After running up the hill, he began to <blank> heavily, trying to catch his breath.",pant,shout,whisper,laugh,0,0,0,
186,perpetual,"The clock in the old tower is famous for its <blank> motion, never stopping even after hundreds of years.",perpetual,temporary,occasional,irregular,0,0,0,
187,persecute,"Throughout history, many groups have been unfairly <blank> because of their beliefs or backgrounds.",persecute,protect,celebrate,ignore,0,0,0,
188,persecution,Many people fled their country to escape <blank> and find safety elsewhere.,persecution,celebration,protection,cooperation,0,0,0,
189,pertinent,The teacher asked the students to only include information that is <blank> to the topic in their essays.,pertinent,irrelevant,random,confusing,0,0,0,
190,pinch,"To make the soup taste better, just add a <blank> of salt before serving.",pinch,drop,slice,spoon,0,0,1,more than one answer
191,plea,The lawyer made a <blank> to the judge for a lighter sentence for his client.,plea,claim,demand,offer,0,0,1,a/an issue
192,plead,The lawyer stood up to <blank> with the judge for a lighter sentence for his client.,plead,argue,demand,propose,1,0,0,more than one answer
193,plunge,"The temperature is expected to <blank> sharply tonight, so make sure to wear warm clothes.",plunge,rise,remain,increase,0,0,0,
194,plural,"In English, nouns that refer to more than one item are written in the <blank> form.",plural,singular,general,abstract,0,0,0,
195,poke,"Be careful not to <blank> the bear with a stick, as it might get angry.",poke,pat,pull,push,0,0,1,more than one answer
196,pose,The photographer asked the model to <blank> in a way that showed confidence and elegance.,pose,stand,move,sit,1,1,1,more than one answer
197,postal,I need to go to the <blank> office to send this package to my friend.,postal,bank,train,grocery,0,0,0,
198,posture,Good <blank> is important when sitting at a desk for long hours to avoid back pain.,posture,gesture,position,movement,0,0,0,
199,preach,The teacher always tries to <blank> kindness and understanding to her students.,preach,ignore,demand,avoid,0,0,0,
200,preclude,The heavy rain did not <blank> us from going on our planned hike in the mountains.,preclude,encourage,assist,permit,0,0,0,
201,prescription,The doctor gave me a <blank> so I could buy the medicine I need from the pharmacy.,prescription,description,subscription,permission,0,0,0,
202,preside,The judge was chosen to <blank> over the court proceedings to ensure fairness and order.,preside,observe,assist,attend,0,0,0,
203,prime,The <blank> reason for their success is their ability to work as a team and support each other.,prime,minor,secondary,average,1,1,0,more than one answer
204,proclamation,The president made a formal <blank> to announce the new policy changes to the public.,proclamation,discussion,argument,observation,0,0,0,
205,profound,"The speaker's words had a <blank> impact on the audience, leaving them deep in thought.",profound,minor,confusing,temporary,0,0,0,
206,prohibit,The school decided to <blank> the use of mobile phones during class to help students focus better.,prohibit,allow,encourage,promote,0,0,0,
207,promote,The school organized a campaign to <blank> healthy eating habits among students.,promote,ignore,prevent,discourage,0,0,0,
208,proposition,The lawyer presented a strong <blank> to support his client's case in court.,proposition,objection,assumption,conclusion,1,0,0,more than one answer
209,prosecute,The lawyer explained that they would <blank> the suspect if there was enough evidence to prove the crime.,prosecute,defend,release,pardon,0,0,0,
210,prosperous,The city became very <blank> after the discovery of gold in the nearby mountains.,prosperous,ordinary,desolate,chaotic,0,0,1,more than one answer
211,provision,The school made special <blank> for students with disabilities to ensure they could participate in all activities.,provision,decision,restriction,condition,0,0,0,
212,quotation,The teacher asked the students to include a famous <blank> in their essays to support their arguments.,quotation,question,statement,comment,0,0,0,
213,radiant,"The bride looked absolutely <blank> in her wedding dress, glowing with happiness and beauty.",radiant,dull,ordinary,gloomy,0,0,0,
214,radical,The new government introduced a <blank> change in the education system to improve learning outcomes.,radical,minor,traditional,gradual,1,0,1,more than one answer
215,raid,The police conducted a <blank> on the house to search for stolen goods.,raid,visit,inspection,journey,0,1,0,a/an issue
216,rapture,The children screamed with <blank> when they saw the fireworks light up the night sky.,rapture,confusion,boredom,fear,0,0,0,
217,rear,"The car's trunk is located at the <blank> of the vehicle, where you can store your luggage.",rear,front,side,top,0,0,0,
218,reassure,The teacher tried to <blank> the students that the test would not be too difficult.,reassure,confuse,frighten,ignore,0,0,0,
219,rebel,The young soldier decided to <blank> against the unfair orders given by his commander.,rebel,obey,support,assist,0,0,0,
220,recall,I can't <blank> where I put my keys this morning.,recall,forget,ignore,imagine,0,0,0,
221,recollect,I can't <blank> where I put my keys this morning. I've been looking for them everywhere.,recollect,predict,imagine,forget,0,0,0,
222,reconstruct,"After the storm destroyed the old bridge, the city decided to <blank> it to ensure safe travel for everyone.",reconstruct,demolish,abandon,decorate,0,0,0,
223,reddish,The sunset painted the sky in beautiful shades of orange and <blank>.,reddish,bluish,yellowish,greenish,0,0,0,
224,refine,"The chef worked hard to <blank> the recipe, making it even better than before.",refine,ignore,ruin,simplify,0,0,0,
225,regime,The new government introduced a strict <blank> to improve the country's economy.,regime,routine,agenda,policy,0,0,1,more than one answer
226,regrettable,It was a <blank> mistake to cancel the event without informing everyone in advance.,regrettable,acceptable,intentional,unavoidable,0,1,1,a/an issue
227,rejoice,"After hearing the good news, the whole family gathered to <blank> together.",rejoice,argue,mourn,complain,0,0,0,
228,relieved,"After hearing the good news, she felt so <blank> that she couldn't stop smiling.",relieved,confused,nervous,angry,0,0,0,
229,render,The new software can <blank> high-quality images in just a few seconds.,render,delete,capture,store,0,1,1,more than one answer
230,reorganize,The manager asked the team to <blank> the files so that they would be easier to find.,reorganize,delete,misplace,scatter,0,0,0,
231,reproach,"He looked at her with a mix of disappointment and <blank>, clearly upset by her actions.",reproach,admiration,gratitude,indifference,0,0,0,
232,resentment,She couldn't hide her <blank> when she found out her colleague got the promotion she wanted.,resentment,happiness,excitement,gratitude,1,0,0,more than one answer
233,reside,Many students <blank> in the dormitories provided by the university during their studies.,reside,travel,visit,explore,0,0,0,
234,resonance,"The speech had a strong emotional <blank> with the audience, leaving many people deeply moved.",resonance,confusion,distance,disconnection,0,0,0,
235,resort,"During the summer, many families choose to stay at a beach <blank> to enjoy the sun and the sea.",resort,station,village,market,0,0,0,
236,respectable,"The teacher is a very <blank> person, and all the students admire her for her fairness and kindness.",respectable,unfriendly,dishonest,careless,0,0,0,
237,respective,The students were asked to return to their <blank> seats after the break.,respective,random,shared,opposite,0,0,0,
238,restoration,"The museum is currently closed for the <blank> of its historic building, which has been damaged over time.",restoration,destruction,construction,removal,0,0,0,
239,revelation,The scientist's discovery was a surprising <blank> that changed the way we understand the universe.,revelation,confusion,assumption,mistake,0,0,0,
240,revolve,The planets in our solar system <blank> around the Sun in elliptical orbits.,revolve,rotate,float,scatter,1,0,0,more than one answer
241,rigid,"The rules of the competition were very <blank>, leaving no room for flexibility or exceptions.",rigid,lenient,unclear,flexible,0,0,0,
242,rosy,"After spending the day hiking in the mountains, her cheeks looked <blank> and healthy.",rosy,pale,dull,gray,0,0,0,
243,royal,The castle was built to serve as a <blank> residence for the king and queen.,royal,public,modern,temporary,0,0,1,more than one answer
244,sanction,The government decided to impose a <blank> on the company for violating environmental laws.,sanction,reward,permit,discount,0,0,0,
245,savage,The explorers were warned about the <blank> animals that lived in the dense jungle.,savage,gentle,friendly,timid,0,0,0,
246,scan,"Before entering the building, you need to <blank> your ID card at the security desk.",scan,write,show,copy,0,1,0,more than one answer
247,sensible,"It’s important to make a <blank> decision when choosing a career path, as it can affect your future.",sensible,reckless,random,emotional,0,0,1,a/an issue
248,sensitive,"He is very <blank> to criticism, so please be careful with your words.",sensitive,confident,careless,indifferent,0,0,0,
249,sheer,"The hikers were amazed by the <blank> size of the mountain, which seemed to rise endlessly into the sky.",sheer,tiny,moderate,narrow,0,0,0,
250,simultaneous,"The two events were <blank>, happening at exactly the same time in different locations.",simultaneous,separate,delayed,random,0,0,0,
251,smear,The child accidentally made a <blank> of paint on the wall while playing with the brushes.,smear,scratch,stain,mark,0,1,1,more than one answer
252,soar,"As the sun set, we watched the birds <blank> high into the sky, disappearing into the clouds.",soar,crawl,sink,stumble,0,0,0,
253,sober,"After the party, he decided to stay <blank> and drink only water.",sober,drunk,tired,confused,0,0,0,
254,solemn,The atmosphere in the room was <blank> as everyone gathered to pay their respects during the ceremony.,solemn,cheerful,chaotic,casual,0,0,0,
255,sore,"After running the marathon, my legs felt very <blank> and I could barely walk.",sore,strong,relaxed,numb,0,0,1,more than one answer
256,sovereign,"The country declared itself a <blank> state, free from any external control or influence.",sovereign,dependent,subordinate,restricted,0,0,0,
257,spectacle,The fireworks display was such an amazing <blank> that everyone in the crowd was left speechless.,spectacle,incident,routine,mystery,0,0,0,
258,spectacular,"The view from the top of the mountain was absolutely <blank>, with the sunset painting the sky in vibrant colors.",spectacular,ordinary,boring,dull,0,0,0,
259,speculate,"Without enough evidence, we can only <blank> about what might have happened.",speculate,confirm,ignore,describe,0,0,0,
260,splendor,"The palace was known for its incredible <blank>, attracting visitors from all over the world.",splendor,simplicity,darkness,poverty,1,0,0,more than one answer
261,stab,"The thief tried to <blank> the man with a knife, but he was stopped by the police in time.",stab,hit,push,grab,0,0,0,
262,stale,The bread was left out for too long and now it tastes <blank>.,stale,fresh,soft,sweet,0,0,0,
263,static,The image on the screen remained <blank> even after adjusting the settings.,static,dynamic,blurry,vivid,0,1,0,more than one answer
264,stem,The <blank> of the plant is usually green and supports the leaves and flowers.,stem,root,branch,trunk,0,1,0,more than one answer
265,stern,The teacher gave the students a <blank> warning about the importance of completing their homework on time.,stern,gentle,casual,vague,1,1,1,more than one answer
266,subdue,The firefighters worked hard to <blank> the flames before they spread to nearby houses.,subdue,ignite,provoke,release,0,0,0,
267,subject,"In school, my favorite <blank> is mathematics because I enjoy solving problems.",subject,object,topic,lesson,0,0,1,more than one answer
268,substantial,"The new policy will bring <blank> changes to the way the company operates, affecting all departments.",substantial,minor,temporary,insignificant,0,0,0,
269,subtract,"To find the correct answer, you need to <blank> the smaller number from the larger one.",subtract,add,multiply,divide,0,0,1,more than one answer
270,supervision,The children were playing safely under the <blank> of their teacher during the school trip.,supervision,attention,observation,guidance,0,0,1,more than one answer
271,surpass,The new smartphone model is expected to <blank> the previous one in terms of speed and performance.,surpass,match,reduce,delay,1,0,0,more than one answer
272,symptom,"If you have a fever and a sore throat, these could be a <blank> of the flu.",symptom,solution,cure,cause,0,0,0,
273,tame,The lion in the zoo is very calm because it has been <blank> by its trainers.,tame,wild,fierce,dangerous,0,0,0,
274,tender,The meat was so <blank> that it practically melted in my mouth.,tender,tough,dry,hard,0,0,0,
275,tentative,"The meeting schedule is still <blank>, as we are waiting for confirmation from all participants.",tentative,final,permanent,definite,0,0,0,
276,terrific,"The view from the top of the mountain was absolutely <blank>, and we couldn't stop taking pictures.",terrific,ordinary,boring,terrible,0,0,0,
277,testimony,The lawyer presented the witness's <blank> in court to support his case.,testimony,opinion,story,argument,1,1,1,more than one answer
278,torture,The movie was so scary that watching it felt like <blank> for some of the audience.,torture,pleasure,relief,comfort,0,0,0,
279,transmission,The <blank> of information from one person to another is essential for effective communication.,transmission,translation,transportation,transformation,0,0,0,
280,trespass,"The sign on the fence clearly says 'No <blank>,' so we should not enter the private property.",trespass,access,permission,entry,1,0,1,more than one answer
281,tribute,The statue was built as a <blank> to honor the soldiers who fought in the war.,tribute,symbol,reminder,gift,1,1,0,more than one answer
282,triumph,"Winning the championship was a great <blank> for the team, as they had worked so hard all season.",triumph,failure,struggle,mistake,0,0,0,
283,trivial,The teacher reminded the students not to waste time on <blank> details and to focus on the main points of the lesson.,trivial,important,complex,relevant,0,1,0,more than one answer
284,tyranny,The citizens fought bravely to end the <blank> that had controlled their country for decades.,tyranny,freedom,democracy,justice,0,0,0,
285,unanimous,"The decision to build the new park was <blank>, as everyone agreed it was a great idea.",unanimous,controversial,divided,uncertain,0,0,0,
286,undo,"If you make a mistake while typing, you can always <blank> it by pressing the correct button.",undo,repeat,delete,skip,0,0,0,
287,undue,The teacher reminded the students to avoid placing <blank> pressure on themselves before the exams.,undue,extreme,necessary,limited,1,0,0,more than one answer
288,upset,She looked very <blank> after hearing the bad news about her exam results.,upset,excited,relaxed,confused,0,0,1,more than one answer
289,urge,The teacher tried to <blank> the students to participate in the charity event by explaining its importance.,urge,ignore,discourage,prevent,0,0,0,
290,utter,He was so nervous during the interview that he could barely <blank> a single word.,utter,write,shout,whisper,0,0,0,
291,vague,The instructions he gave were so <blank> that nobody knew exactly what to do.,vague,clear,specific,detailed,0,0,0,
292,variation,The teacher explained that there is often a slight <blank> in the way people pronounce the same word in different regions.,variation,confusion,repetition,translation,0,0,0,
293,veil,The bride wore a beautiful white dress and a delicate <blank> over her face during the ceremony.,veil,scarf,hat,mask,0,0,0,
294,vicinity,"There are several good restaurants in the <blank> of the hotel, so you don’t need to travel far for a meal.",vicinity,center,distance,region,1,0,0,more than one answer
295,vicious,"The dog became <blank> when it felt threatened, growling and baring its teeth.",vicious,friendly,calm,playful,0,0,0,
296,vigor,"After a good night's sleep, she woke up feeling full of <blank> and ready to start the day.",vigor,laziness,confusion,sadness,0,0,0,
297,vocation,"She always felt that teaching was her true <blank>, as it brought her immense joy and satisfaction.",vocation,hobby,habit,occupation,0,0,1,
298,wanting,"After the long hike, she was really <blank> a cold drink to refresh herself.",wanting,avoiding,ignoring,rejecting,0,0,0,
299,witness,The police are looking for someone who was a <blank> to the accident and can provide more information.,witness,suspect,victim,offender,0,0,1,a/an issue
300,wreck,The divers discovered the <blank> of an old ship at the bottom of the ocean.,wreck,treasure,map,island,1,0,0,more than one answer
